verb,english,present_ich,present_du,present_er,perfect,example,notes
sein,to be,bin,bist,ist,ist gewesen,Ich bin müde.,Highly irregular, no pattern
haben,to have,habe,hast,hat,hat gehabt,Er hat ein Auto.,Irregular in perfect tense
gehen,to go,gehe,gehst,geht,ist gegangen,Sie geht zur Schule.,Irregular perfect with 'ist'
kommen,to come,komme,kommst,kommt,ist gekommen,Woher kommst du?,Irregular perfect with 'ist'
sehen,to see,sehe,siehst,sieht,hat gesehen,Sie sieht einen Film.,Vowel change in present tense 